{
  "$schema": "../contracts/v1/identity-experience-content.schema.json",
  "schema": "identity.experience-content/v1",
  "site": {
    "canonicalUrl": "https://egohygiene.io/identity/",
    "basePath": "/identity/",
    "title": "Identity — governed Brand Kits",
    "description": "Turn reviewed identity intent into accessible, portable, release-backed Brand Kit projections.",
    "packageName": "@egohygiene/identity-experience"
  },
  "assets": {
    "mascot": "full",
    "socialImage": "assets/identity/brand/social-preview.svg",
    "favicon": "assets/identity/web/favicon.png",
    "palette": "assets/identity/web/identity-palette.css"
  },
  "launchkit": {
    "schema": "holon.launchkit-content/v1",
    "identity": {
      "wordmark": "identity"
    },
    "navigation": [
      { "label": "System", "href": "#features" },
      { "label": "How it works", "href": "#architecture" },
      { "label": "Documentation", "href": "/identity/docs/" },
      { "label": "Architecture", "href": "/identity/architecture/" },
      { "label": "Brand Kit", "href": "https://identity.egohygiene.io/" }
    ],
    "announcement": {
      "label": "Inspect the release evidence",
      "href": "/identity/publication.json"
    },
    "hero": {
      "eyebrow": "Governed identity infrastructure",
      "title": "Carry intent all the way to the artifact.",
      "description": "Identity keeps semantic tokens, approved assets, voice, usage, rights, and human decisions intact as deterministic projections move across products and platforms.",
      "actions": [
        { "label": "Read the documentation", "href": "/identity/docs/", "tone": "primary" },
        { "label": "Open the Brand Kit", "href": "https://identity.egohygiene.io/", "tone": "secondary" }
      ]
    },
    "proof": {
      "title": "Inspectable by construction",
      "items": ["Offline source inputs", "Human-approved assets", "Content-addressed output", "Independent rollback"]
    },
    "demo": {
      "eyebrow": "Meet Kern",
      "title": "A guide, never the source of truth.",
      "description": "Kern supports the story while the surrounding text, contracts, manifests, and evidence carry the meaning. His approved projection, alt text, rights, and provenance are resolved from Identity's governed package.",
      "assetRef": "mascot"
    },
    "features": {
      "eyebrow": "One governed system",
      "title": "Brand truth that survives the framework.",
      "description": "Canonical intent remains portable while every adapter stays replaceable.",
      "items": [
        { "eyebrow": "Kernel", "title": "Semantic intent", "description": "Model color, typography, spacing, motion, imagery, marks, voice, and operational meaning without binding them to one renderer." },
        { "eyebrow": "Governance", "title": "Rights and decisions", "description": "Keep license, provenance, approval, accessibility, usage, and source lineage attached to each public projection." },
        { "eyebrow": "Compiler", "title": "Deterministic packages", "description": "Validate, resolve, plan, render, verify, and checksum portable outputs with stable diagnostics and rollback evidence." },
        { "eyebrow": "Consumers", "title": "Framework-neutral delivery", "description": "Feed reviewed outputs to sites, docs, repositories, applications, press kits, and social surfaces without a second brand source." }
      ]
    },
    "useCases": {
      "eyebrow": "Use Identity",
      "title": "Project once, integrate deliberately.",
      "description": "Each consumer selects the compatible outputs it needs and records the immutable release it reviewed.",
      "items": [
        { "title": "Product identity", "description": "Inherit organization semantics and record intentional, approved product differences." },
        { "title": "Repository surfaces", "description": "Generate marks, social previews, documentation styles, and metadata from the same reviewed input." },
        { "title": "Portable packages", "description": "Distribute tokens, assets, guidance, checksums, and deterministic archives without exposing internal compiler modules." }
      ]
    },
    "code": {
      "eyebrow": "Local-first",
      "title": "Validate before projecting.",
      "description": "Identity reads reviewed repository inputs, reports concrete recovery guidance, and does not fetch mutable brand source from the web.",
      "language": "shell",
      "value": "python3 scripts/validate_identity.py \\\n  --repository-root \"path/to/consumer\" \\\n  --format \"human\"\n\ncargo run --locked -- v1-generate \\\n  --repository-root \"path/to/consumer\"\n\ncargo run --locked -- v1-verify \\\n  --repository-root \"path/to/consumer\""
    },
    "architecture": {
      "eyebrow": "Governed flow",
      "title": "Every transformation leaves evidence.",
      "description": "The compiler separates human intent, generated projections, transient review state, and published artifacts.",
      "items": [
        { "eyebrow": "01", "title": "Review intent", "description": "Approve source, tokens, guidance, rights, provenance, and the intended output profiles." },
        { "eyebrow": "02", "title": "Compile projections", "description": "Resolve inheritance and aliases, plan exact mutations, render offline, and fail closed on drift or missing evidence." },
        { "eyebrow": "03", "title": "Publish exact bytes", "description": "Hand a content-addressed artifact to the owning surface, verify the live release binding, and retain a known rollback target." }
      ]
    },
    "integrations": {
      "eyebrow": "Dogfooded composition",
      "title": "Clear ownership at every seam.",
      "description": "This experience proves the contract without moving authority into a site framework.",
      "items": [
        { "title": "LaunchKit", "description": "Holon owns the landing information architecture and accessible static-first presentation.", "href": "https://github.com/egohygiene/holon" },
        { "title": "Zensical", "description": "Holon's shared docs profile renders reviewed documentation, architecture, and legal content without becoming its source.", "href": "/identity/docs/" },
        { "title": "Relay", "description": "The organization route owner installs the reviewed composite without rebuilding or changing it.", "href": "https://github.com/egohygiene/relay" }
      ]
    },
    "trust": {
      "eyebrow": "Evidence first",
      "title": "Inspect the exact thing you are using.",
      "description": "Release, source, asset, rights, approval, route, checksum, and rollback evidence stay reachable from the experience.",
      "links": [
        { "label": "Publication manifest", "href": "/identity/publication.json" },
        { "label": "Canonical Brand Kit evidence", "href": "https://identity.egohygiene.io/site.json" },
        { "label": "Source repository", "href": "https://github.com/egohygiene/identity" },
        { "label": "Security policy", "href": "https://github.com/egohygiene/identity/security/policy" }
      ]
    },
    "faq": {
      "eyebrow": "Boundaries",
      "title": "What this experience proves.",
      "description": "The dogfood is a consumer of Identity, not a new authority over it.",
      "items": [
        { "question": "Is LaunchKit the Identity design system?", "answer": "No. LaunchKit is a replaceable presentation adapter. It consumes reviewed Identity outputs and owns only landing composition." },
        { "question": "Does Zensical own the documentation source?", "answer": "No. Repository-owned Markdown is durable source. Zensical is pinned rendering and navigation infrastructure for the docs subtree." },
        { "question": "Can this page change canonical tokens or assets?", "answer": "No. The build is read-only over reviewed Identity outputs and fails when selected bytes, alt text, provenance, approval, or release evidence drift." },
        { "question": "How does rollback work?", "answer": "The organization route owner re-promotes a preceding verified composite. The canonical Brand Kit rolls back independently through an earlier stable annotated Identity tag." }
      ]
    },
    "finalCta": {
      "title": "Make identity explainable at the point of use.",
      "description": "Start with the contracts, inspect the release evidence, then consume the smallest compatible package your surface needs.",
      "actions": [
        { "label": "Explore the docs", "href": "/identity/docs/", "tone": "primary" },
        { "label": "Download the Brand Kit", "href": "https://identity.egohygiene.io/", "tone": "secondary" }
      ]
    },
    "footer": {
      "summary": "Identity turns reviewed intent into governed, portable Brand Kit projections.",
      "groups": [
        {
          "title": "Identity",
          "links": [
            { "label": "Documentation", "href": "/identity/docs/" },
            { "label": "Brand Kit", "href": "https://identity.egohygiene.io/" },
            { "label": "Repository", "href": "https://github.com/egohygiene/identity" }
          ]
        },
        {
          "title": "Evidence",
          "links": [
            { "label": "Publication manifest", "href": "/identity/publication.json" },
            { "label": "Release evidence", "href": "https://identity.egohygiene.io/site.json" },
            { "label": "Releases", "href": "https://github.com/egohygiene/identity/releases" }
          ]
        }
      ],
      "legal": [
        { "label": "Legal and trust", "href": "/identity/legal/" },
        { "label": "Kern attribution", "href": "/identity/docs/kern/" },
        { "label": "Support", "href": "https://github.com/egohygiene/identity/blob/main/SUPPORT.md" }
      ]
    }
  },
  "siteSuite": {
    "schema": "holon.site-suite-content/v1",
    "product": {
      "name": "Identity",
      "description": "Governed identity contracts and deterministic, release-backed Brand Kit projections.",